{
  "$schema": "https://json-schema.org/draft/2020-12/schema",
  "title": "jev request",
  "description": "A complete evaluation request: `state`, `model` and `questions`. This is the body of `POST /v1/systemone` exactly, and a request file `jev eval -f` can send as it is. A file that leaves out `state` or `model` follows the `questions` schema instead.",
  "type": "object",
  "properties": {
    "state": {
      "description": "The content to evaluate: a string, or structured data such as a chat log or a record.\n\nThe API rejects `null` and scalar values here.",
      "type": [
        "string",
        "object",
        "array"
      ]
    },
    "model": {
      "type": "string",
      "description": "The model that handles the request: an alias such as `jev-latest`, or a versioned id such\nas `jev-1.13.0`. Aliases move without notice; pin a versioned id once thresholds are tuned."
    },
    "questions": {
      "type": "object",
      "additionalProperties": {
        "oneOf": [
          {
            "type": "object",
            "properties": {
              "type": {
                "type": "string",
                "const": "noul"
              },
              "instructions": {
                "description": "The yes/no question to evaluate.\n\nThe API reference marks this as required. In practice the server also accepts a Noul that\nhas only `criteria`, so it is optional here and offline validation decides.",
                "type": [
                  "string",
                  "object",
                  "array",
                  "null"
                ]
              },
              "criteria": {
                "type": [
                  "object",
                  "null"
                ],
                "properties": {
                  "true": {
                    "description": "What a yes (a value near 1) means.",
                    "type": [
                      "string",
                      "object",
                      "array",
                      "null"
                    ]
                  },
                  "false": {
                    "description": "What a no (a value near 0) means.",
                    "type": [
                      "string",
                      "object",
                      "array",
                      "null"
                    ]
                  }
                },
                "description": "Optional descriptions of what a yes and a no mean.",
                "additionalProperties": false
              }
            },
            "description": "A yes/no question, answered with the probability of yes.",
            "required": [
              "type",
              "instructions"
            ],
            "unevaluatedProperties": false
          },
          {
            "type": "object",
            "properties": {
              "type": {
                "type": "string",
                "const": "choice"
              },
              "instructions": {
                "description": "What the model should decide.\n\nMarked required by the API reference, although the server accepts a Choice without it.",
                "type": [
                  "string",
                  "object",
                  "array",
                  "null"
                ]
              },
              "criteria": {
                "type": "object",
                "additionalProperties": {
                  "description": "Free-form content: a string, an object, an array, or null.",
                  "type": [
                    "string",
                    "object",
                    "array",
                    "null"
                  ]
                },
                "description": "Each option mapped to its description, or to `null` when the name says enough.\n\nOptions keep the order they were written in. The API allows up to 255 of them. A repeated\noption is a parse error when reading JSON or YAML text directly.",
                "minProperties": 1,
                "maxProperties": 255
              }
            },
            "required": [
              "type",
              "instructions",
              "criteria"
            ],
            "description": "Pick one option from a set, answered with a probability per option.",
            "unevaluatedProperties": false
          },
          {
            "type": "object",
            "properties": {
              "type": {
                "type": "string",
                "const": "score"
              },
              "instructions": {
                "description": "What the model should rate.\n\nMarked required by the API reference, although the server accepts a Score without it.",
                "type": [
                  "string",
                  "object",
                  "array",
                  "null"
                ]
              },
              "criteria": {
                "type": "array",
                "items": {
                  "description": "Free-form content: a string, an object, or an array.",
                  "type": [
                    "string",
                    "object",
                    "array"
                  ]
                },
                "minItems": 2,
                "maxItems": 10,
                "description": "Level descriptions in order, from level 0 upwards. The API allows 2 to 10 levels.\n\nUnlike a choice option, a level cannot be `null`: the server rejects it with a 422."
              }
            },
            "required": [
              "type",
              "instructions",
              "criteria"
            ],
            "description": "Rate along an ordered rubric, answered with a probability per level.",
            "unevaluatedProperties": false
          },
          {
            "type": "object",
            "properties": {
              "instructions": {
                "description": "What to find, and in which image. It need not be a question.",
                "type": [
                  "string",
                  "object",
                  "array",
                  "null"
                ]
              },
              "type": {
                "type": "string",
                "const": "box"
              }
            },
            "description": "Locate something in an image, answered with the four edges of a box.",
            "required": [
              "type",
              "instructions"
            ],
            "unevaluatedProperties": false
          }
        ],
        "description": "One typed question. The `type` field selects the kind: `noul`, `choice`, `score` or `box`. The question id is never sent to the model, so put the full meaning in `instructions`."
      },
      "description": "The questions, keyed by an id the caller chooses. Answers come back under the same ids.\n\nQuestions keep the order they were written in. Ids are never sent to the model. A repeated\nid is a parse error when reading JSON or YAML text directly (a parser that has already\ncollapsed the document into a generic value keeps only the last one).",
      "minProperties": 1
    },
    "assets": {
      "type": [
        "object",
        "null"
      ],
      "additionalProperties": {
        "type": "object",
        "properties": {
          "type": {
            "type": [
              "string",
              "null"
            ],
            "description": "The kind of asset. Only `image` exists; the API treats an absent `type` as `image`."
          },
          "data_base64": {
            "type": [
              "string",
              "null"
            ],
            "description": "The file, standard base64 with `=` padding, no line breaks and no `data:` prefix."
          },
          "format": {
            "type": [
              "string",
              "null"
            ],
            "description": "`png`, `jpg` or `jpeg`. Required with `data_base64`."
          },
          "part": {
            "type": [
              "string",
              "null"
            ],
            "description": "The name of a multipart file part holding the image. This crate sends JSON bodies only,\nso validation refuses it; it is kept so that a request is parsed as written."
          }
        },
        "description": "One image, keyed by a reference string. Write that reference in the state, in a question's instructions or in its criteria, and the model sees the image there. `data_base64` is the file, base64 encoded, with `format` saying which kind."
      },
      "description": "Images the request carries, keyed by the reference string written where each image belongs: in `state`, or in a question's `instructions` or `criteria`. Needs `jev-preview`."
    }
  },
  "required": [
    "state",
    "model",
    "questions"
  ],
  "additionalProperties": false
}
